{
  "api_schema_version": "1.0",
  "run_id": "0123456789abcdef0123456789abcdef",
  "snapshot_hash": "749b03a8ffbb0dda43a2fa1fd4a099a6e8618f1c8e732a2a4c3bfcc4f5c8cc55",
  "created_at": "2026-10-20T12:00:00Z",
  "source": "SIM",
  "run": {
    "mode": "desk",
    "seed": 20201020,
    "paths": 1000,
    "preview": true,
    "horizon_days": 21,
    "step": "daily"
  },
  "model_card": {
    "model_card_schema_version": "1.0",
    "model_version": "fixture-1",
    "snapshot_hash": "749b03a8ffbb0dda43a2fa1fd4a099a6e8618f1c8e732a2a4c3bfcc4f5c8cc55",
    "profile_name": "default",
    "profile_hash": "f64e4e3cfcbef5ca008886d2646a493b5bfe32a1f2ad38a35d8f72bdc4455f13",
    "mode": "desk",
    "seed": 20201020,
    "paths": 1000,
    "preview": true,
    "horizon_days": 21,
    "step": "daily",
    "convergence": {
      "checked": false,
      "max_shift_in_standard_errors": null,
      "passed": null
    },
    "validation": [
      {
        "check": "contract fixture only",
        "passed": true,
        "note": "Shape example; not model output."
      }
    ],
    "data_label": "SIM",
    "limitations": "Synthetic data and illustrative parameters. Shape example only; not evidence of real-world risk."
  },
  "effective_settings": [
    {
      "position_id": "L1",
      "kind": "loan",
      "mpor_days": 5,
      "settings": {
        "mpor_liquid_days": 5,
        "mpor_other_days": 10,
        "mpor_concentrated_days": 10,
        "mpor_pool_forced_sale_days": 5,
        "mpor_fixed_days": null,
        "addon_days": 0,
        "concentration_threshold_pct_adv": 25,
        "htb_uses_concentrated_period": true,
        "impact_k": 0.5,
        "impact_alpha": 0.5,
        "half_spread_floor_bps": 0,
        "cost_cap_bps": null,
        "stress_beta": 0,
        "stress_factor": "equity",
        "unwind": "end_of_period",
        "margin_call_every_days": 1
      },
      "source_levels": {
        "mpor_liquid_days": "default",
        "mpor_other_days": "default",
        "mpor_concentrated_days": "default",
        "mpor_pool_forced_sale_days": "default",
        "mpor_fixed_days": "default",
        "addon_days": "default",
        "concentration_threshold_pct_adv": "default",
        "htb_uses_concentrated_period": "default",
        "impact_k": "default",
        "impact_alpha": "default",
        "half_spread_floor_bps": "default",
        "cost_cap_bps": "default",
        "stress_beta": "default",
        "stress_factor": "default",
        "unwind": "default",
        "margin_call_every_days": "default"
      }
    },
    {
      "position_id": "L2",
      "kind": "loan",
      "mpor_days": 5,
      "settings": {
        "mpor_liquid_days": 5,
        "mpor_other_days": 10,
        "mpor_concentrated_days": 10,
        "mpor_pool_forced_sale_days": 5,
        "mpor_fixed_days": null,
        "addon_days": 0,
        "concentration_threshold_pct_adv": 25,
        "htb_uses_concentrated_period": true,
        "impact_k": 0.5,
        "impact_alpha": 0.5,
        "half_spread_floor_bps": 0,
        "cost_cap_bps": null,
        "stress_beta": 0,
        "stress_factor": "equity",
        "unwind": "end_of_period",
        "margin_call_every_days": 1
      },
      "source_levels": {
        "mpor_liquid_days": "default",
        "mpor_other_days": "default",
        "mpor_concentrated_days": "default",
        "mpor_pool_forced_sale_days": "default",
        "mpor_fixed_days": "default",
        "addon_days": "default",
        "concentration_threshold_pct_adv": "default",
        "htb_uses_concentrated_period": "default",
        "impact_k": "default",
        "impact_alpha": "default",
        "half_spread_floor_bps": "default",
        "cost_cap_bps": "default",
        "stress_beta": "default",
        "stress_factor": "default",
        "unwind": "default",
        "margin_call_every_days": "default"
      }
    },
    {
      "position_id": "L3",
      "kind": "loan",
      "mpor_days": 5,
      "settings": {
        "mpor_liquid_days": 5,
        "mpor_other_days": 10,
        "mpor_concentrated_days": 10,
        "mpor_pool_forced_sale_days": 5,
        "mpor_fixed_days": null,
        "addon_days": 0,
        "concentration_threshold_pct_adv": 25,
        "htb_uses_concentrated_period": true,
        "impact_k": 0.5,
        "impact_alpha": 0.5,
        "half_spread_floor_bps": 0,
        "cost_cap_bps": null,
        "stress_beta": 0,
        "stress_factor": "equity",
        "unwind": "end_of_period",
        "margin_call_every_days": 1
      },
      "source_levels": {
        "mpor_liquid_days": "default",
        "mpor_other_days": "default",
        "mpor_concentrated_days": "default",
        "mpor_pool_forced_sale_days": "default",
        "mpor_fixed_days": "default",
        "addon_days": "default",
        "concentration_threshold_pct_adv": "default",
        "htb_uses_concentrated_period": "default",
        "impact_k": "default",
        "impact_alpha": "default",
        "half_spread_floor_bps": "default",
        "cost_cap_bps": "default",
        "stress_beta": "default",
        "stress_factor": "default",
        "unwind": "default",
        "margin_call_every_days": "default"
      }
    }
  ],
  "program": {
    "gaussian": {
      "with_wrong_way": {
        "total": {
          "el": {
            "value": 1000,
            "std_error": 50
          },
          "epe": {
            "value": 15000,
            "std_error": 750
          },
          "pfe95": {
            "value": 90000,
            "std_error": 4500
          },
          "pfe99": {
            "value": 150000,
            "std_error": 7500
          },
          "var99": {
            "value": 120000,
            "std_error": 6000
          },
          "var999": {
            "value": 260000,
            "std_error": 13000
          },
          "es99": {
            "value": 180000,
            "std_error": 9000
          },
          "es999": {
            "value": 300000,
            "std_error": 15000
          }
        },
        "default_shortfall": {
          "el": {
            "value": 700,
            "std_error": 35
          },
          "epe": {
            "value": 10500,
            "std_error": 525
          },
          "pfe95": {
            "value": 63000,
            "std_error": 3150
          },
          "pfe99": {
            "value": 105000,
            "std_error": 5250
          },
          "var99": {
            "value": 84000,
            "std_error": 4200
          },
          "var999": {
            "value": 182000,
            "std_error": 9100
          },
          "es99": {
            "value": 126000,
            "std_error": 6300
          },
          "es999": {
            "value": 210000,
            "std_error": 10500
          }
        },
        "reinvestment": {
          "el": {
            "value": 300,
            "std_error": 15
          },
          "epe": {
            "value": 4500,
            "std_error": 225
          },
          "pfe95": {
            "value": 27000,
            "std_error": 1350
          },
          "pfe99": {
            "value": 45000,
            "std_error": 2250
          },
          "var99": {
            "value": 36000,
            "std_error": 1800
          },
          "var999": {
            "value": 78000,
            "std_error": 3900
          },
          "es99": {
            "value": 54000,
            "std_error": 2700
          },
          "es999": {
            "value": 90000,
            "std_error": 4500
          }
        }
      },
      "without_wrong_way": {
        "total": {
          "el": {
            "value": 800,
            "std_error": 40
          },
          "epe": {
            "value": 12000,
            "std_error": 600
          },
          "pfe95": {
            "value": 72000,
            "std_error": 3600
          },
          "pfe99": {
            "value": 120000,
            "std_error": 6000
          },
          "var99": {
            "value": 96000,
            "std_error": 4800
          },
          "var999": {
            "value": 208000,
            "std_error": 10400
          },
          "es99": {
            "value": 144000,
            "std_error": 7200
          },
          "es999": {
            "value": 240000,
            "std_error": 12000
          }
        },
        "default_shortfall": {
          "el": {
            "value": 560,
            "std_error": 28
          },
          "epe": {
            "value": 8400,
            "std_error": 420
          },
          "pfe95": {
            "value": 50400,
            "std_error": 2520
          },
          "pfe99": {
            "value": 84000,
            "std_error": 4200
          },
          "var99": {
            "value": 67200,
            "std_error": 3360
          },
          "var999": {
            "value": 145600,
            "std_error": 7280
          },
          "es99": {
            "value": 100800,
            "std_error": 5040
          },
          "es999": {
            "value": 168000,
            "std_error": 8400
          }
        },
        "reinvestment": {
          "el": {
            "value": 240,
            "std_error": 12
          },
          "epe": {
            "value": 3600,
            "std_error": 180
          },
          "pfe95": {
            "value": 21600,
            "std_error": 1080
          },
          "pfe99": {
            "value": 36000,
            "std_error": 1800
          },
          "var99": {
            "value": 28800,
            "std_error": 1440
          },
          "var999": {
            "value": 62400,
            "std_error": 3120
          },
          "es99": {
            "value": 43200,
            "std_error": 2160
          },
          "es999": {
            "value": 72000,
            "std_error": 3600
          }
        }
      }
    },
    "student_t": {
      "total": {
        "el": {
          "value": 1200,